availability,category,description,no_of_reviews,price_excl_tax,price_incl_tax,product_type,stars,tax,title,upc,url
18,spirituality,"In The Four Agreements, don Miguel Ruiz reveals the source of self-limiting beliefs that rob us of joy and create needless suffering. Based on ancient Toltec wisdom, the Four Agreements offer a powerful code of conduct that can rapidly transform our lives to a new experience of freedom, true happiness, and love. The Four Agreements are: Be Impeccable With Your Word, Don't In The Four Agreements, don Miguel Ruiz reveals the source of self-limiting beliefs that rob us of joy and create needless suffering. Based on ancient Toltec wisdom, the Four Agreements offer a powerful code of conduct that can rapidly transform our lives to a new experience of freedom, true happiness, and love. The Four Agreements are: Be Impeccable With Your Word, Don't Take Anything Personally, Don't Make Assumptions, Always Do Your Best. ...more",0,17.66,17.66,books,5,0.0,The Four Agreements: A Practical Guide to Personal Freedom,6258a1f6a6dcfe50,https://books.toscrape.com/catalogue/the-four-agreements-a-practical-guide-to-personal-freedom_970/index.html
18,art,"Banksy, Britain's now-legendary ""guerilla"" street artist, has painted the walls, streets, and bridges of towns and cities throughout the world. Not only did he smuggle his pieces into four of New York City's major art museums, he's also ""hung"" his work at London's Tate Gallery and adorned Israel's West Bank barrier with satirical images. Banksy's identity remains unknown, Banksy, Britain's now-legendary ""guerilla"" street artist, has painted the walls, streets, and bridges of towns and cities throughout the world. Not only did he smuggle his pieces into four of  New York City's major art museums, he's also ""hung"" his work at London's Tate Gallery and adorned Israel's West Bank barrier with satirical images. Banksy's identity remains unknown, but his work is unmistakable—with prints selling for as much as $45,000. ...more",0,44.18,44.18,books,4,0.0,Wall and Piece,ccd9ffa25efabdea,https://books.toscrape.com/catalogue/wall-and-piece_971/index.html
18,nonfiction,"Anti-apartheid activist, Bollywood screenwriter, Nazi pin-up, hero of the Wild West: this is Shakespeare as you have never seen him before.From the sixteenth-century Baltic to the American Revolution, from colonial India to the skyscrapers of modern-day Shanghai, Shakespeare’s plays appear at the most fascinating of times and in the most unexpected of places. No other writ Anti-apartheid activist, Bollywood screenwriter, Nazi pin-up, hero of the Wild West: this is Shakespeare as you have never seen him before.From the sixteenth-century Baltic to the American Revolution, from colonial India to the skyscrapers of modern-day Shanghai, Shakespeare’s plays appear at the most fascinating of times and in the most unexpected of places. No other writer’s work has been performed, translated, adapted and altered in such a remarkable variety of cultures and languages. But what is it about William Shakespeare – a man from Warwickshire who never once set foot outside England – that has made him at home in so many places around the globe?Travelling across four continents, six countries and 400 years, Andrew Dickson takes us on a personal journey rich in insight and surprise. We enter the air-conditioned vault deep beneath Capitol Hill where the world’s largest collection of First Folios is stored; discover the shadowy history of Joseph Goebbels’s obsession with Shakespeare; and uncover the true story behind the scuffed edition in which Nelson Mandela and fellow Robben Island prisoners inscribed their names. Both cultural history and literary travelogue, Worlds Elsewhere is an attempt to understand how Shakespeare has become the international phenomenon he is – and why.""There were very few pages on which I didn’t learn something new or revelatory. A must-read for anyone interested in Shakespeare’s impact on people and politics around the globe"" (James Shapiro, author of 1599: A Year in the Life of William Shakespeare)""Immensely well-informed and highly readable. A revelatory journey of cultural exploration"" (Professor Stanley Wells, General Editor of the Oxford and Penguin Shakespeares)""Brilliantly original. Absolutely engaging, witty and irresistible. What’s most remarkable: he’s said something new about Shakespeare"" (Michael Pye, author of The Edge of the World)""A truly original book about Shakespeare: one that explores the dramatist's global reach with tenacity, devotion and an exhilarating spirit of adventure"" (Michael Billington) ...more",0,40.3,40.3,books,5,0.0,Worlds Elsewhere: Journeys Around Shakespeare’s Globe,4c28def39d850cdf,https://books.toscrape.com/catalogue/worlds-elsewhere-journeys-around-shakespeares-globe_972/index.html
19,romance,"No matter how busy he keeps himself, successful Broadway musician Tobias Spence can’t outrun the memory of a tragic car crash from his past that claimed a friend’s life and permanently injured his former boyfriend, Emmett.Even after losing Tobias, Emmett Henderson made peace with that awful night, living in his Indiana hometown where he has become a revered choral director No matter how busy he keeps himself, successful Broadway musician Tobias Spence can’t outrun the memory of a tragic car crash from his past that claimed a friend’s life and permanently injured his former boyfriend, Emmett.Even after losing Tobias, Emmett Henderson made peace with that awful night, living in his Indiana hometown where he has become a revered choral director. When his students are asked to perform in New York City, he decides to chance reconnecting with his former love, if for no other reason than to get a proper goodbye.When Emmett and Tobias finally meet 15 years after parting ways, it is clear to both of them that their feelings for each other have not changed. As they explore their renewed relationship, the two men face old hurts and the new challenges of a long-distance romance. Will Tobias lose his second chance at love to the ghosts he can’t seem to put to rest? ...more",0,34.53,34.53,books,5,0.0,Black Dust,00bfed9e18bb36f3,https://books.toscrape.com/catalogue/black-dust_976/index.html
19,romance,"A Michelin two-star chef at twenty-eight, Violette Lenoir could handle anything, including a cocky burglar who broke into her restaurant in the middle of the night.Or so she thought.Elite counterterrorist operative Chase “Smith” had been through things that made Hell Week look easy. But nothing had prepared him for a leather-clad blonde who held him at bay at knifepoint an A Michelin two-star chef at twenty-eight, Violette Lenoir could handle anything, including a cocky burglar who broke into her restaurant in the middle of the night.Or so she thought.Elite counterterrorist operative Chase “Smith” had been through things that made Hell Week look easy. But nothing had prepared him for a leather-clad blonde who held him at bay at knifepoint and dared him to take her on.Now if only saving the world didn’t require he ruin her life.Two people who thought they could handle anything now have to take on each other. It's a battle neither one expected. But with their futures on the line, they have nothing to lose...but their hearts.Warning: This book contains one arrogant Navy SEAL, nights of Paris passion, and a woman who wants to have it all. ...more",0,25.27,25.27,books,5,0.0,Chase Me (Paris Nights #2),c2e46a2ee3b4a322,https://books.toscrape.com/catalogue/chase-me-paris-nights-2_977/index.html
19,default,"Planning on seeing Aladdin the Disney musical? Read the classic story of ""Aladdin and his Wonderful Lamp"" in this sparkling new edition by Harpendore. Synopsis: Aladdin is a poor boy who lives with his mother in the ancient kingdom of Cathay. One day a strange man appears offering untold riches! Aladdin is not so sure, yet he's sorely tempted. Join Aladdin on his incredib Planning on seeing Aladdin the Disney musical? Read the classic story of ""Aladdin and his Wonderful Lamp"" in this sparkling new edition by Harpendore. Synopsis: Aladdin is a poor boy who lives with his mother in the ancient kingdom of Cathay. One day a strange man appears offering untold riches! Aladdin is not so sure, yet he's sorely tempted. Join Aladdin on his incredible adventures and visit the cave of treasures. A world of magic awaits you, but watch your step - there's mischief lurking at every turn! The Arabian Nights (also known as The One Thousand and One Nights) is an ancient collection of tales that have existed for thousands of years. Harpendore's Arabian Nights Adventures are beautifully retold versions of these ancient classics that are specially designed to appeal to children aged seven years and above. They are written in a warm and accessible style and include wonderful illustrations inside. With mischief and magic in equal measure, this series is sure to captivate readers everywhere. The Arabian Nights Adventures series is being released throughout 2016 and 2017. Stories to be included are: The Adventures of Prince Camar & Princess Badoura Aladdin and his Wonderful Lamp Gulnare of the Sea Ali Baba and the Forty Thieves The Seven Voyages of Sinbad the Sailor The Enchanted Horse The Talking Bird, the Singing Tree and the Golden Water The Merchant and the Genie The Tale of Zubaidah and the Three Qalandars The Adventures of Harun al-Rashid, Caliph of Baghdad The Three Princes, the Princess and the Jinni Pari Banou The Fisherman and the Genie The King's Jester (also known as The Little Hunchback) ...more",0,53.13,53.13,books,3,0.0,Aladdin and His Wonderful Lamp,904208d6aa64b655,https://books.toscrape.com/catalogue/aladdin-and-his-wonderful-lamp_973/index.html
19,food and drink,"Canning perfected the America’s Test Kitchen way. The art of preserving produce by canning and preserving has come full circle from grandmother's kitchen to a whole new generation now eager to learn it. This detailed guide to home preserving is perfect for novice canners and experts alike and offers more than 100 foolproof recipes across a wide range of categories, from sw Canning perfected the America’s Test Kitchen way. The art of preserving produce by canning and preserving has come full circle from grandmother's kitchen to a whole new generation now eager to learn it. This detailed guide to home preserving is perfect for novice canners and experts alike and offers more than 100 foolproof recipes across a wide range of categories, from sweet jams and jellies to savory jams, vegetables, condiments, pickles, whole fruits, and more. Let the experts at America's Test Kitchen show you how to do it right with detailed tutorials, troubleshooting tips, equipment information, and insight into the science behind canning. ...more",0,30.52,30.52,books,3,0.0,"Foolproof Preserving: A Guide to Small Batch Jams, Jellies, Pickles, Condiments, and More: A Foolproof Guide to Making Small Batch Jams, Jellies, Pickles, Condiments, and More",5674a18a29a43ced,https://books.toscrape.com/catalogue/foolproof-preserving-a-guide-to-small-batch-jams-jellies-pickles-condiments-and-more-a-foolproof-guide-to-making-small-batch-jams-jellies-pickles-condiments-and-more_978/index.html
19,childrens,"Bring the thrilling story of one red bird to life. When an innocent bird meets two cruel kids, their world is forever changed. But exactly how that change unfolds is up to you, in the tradition of Kamishibai—Japanese paper theater. The wordless story by master cartoonist James Sturm is like a haiku—the elegant images leave space for children to inhabit this timeless tale—a Bring the thrilling story of one red bird to life. When an innocent bird meets two cruel kids, their world is forever changed. But exactly how that change unfolds is up to you, in the tradition of Kamishibai—Japanese paper theater. The wordless story by master cartoonist James Sturm is like a haiku—the elegant images leave space for children to inhabit this timeless tale—and make it their own, leading them to learn an ultimate lesson they'll never forget.James Sturm is the author of several books for kids including the Adventures in Cartooning series (with Andrew Arnold and Alexis Frederick-Frost) and the forthcoming Ape and Armadillo. James also helped start a college for cartoonists, The Center for Cartoon Studies, in the small railroad village of White River Junction, Vermont. ...more",0,54.64,54.64,books,3,0.0,Birdsong: A Story in Pictures,9528d0948525bf5f,https://books.toscrape.com/catalogue/birdsong-a-story-in-pictures_975/index.html
19,default,"Any fan of the Baltimore Colts of my era, any fan of my friend and teammate Johnny Unitas, or, for that matter, any fan of football in general should enjoy Wayne Stewart's book. It contains great stories, statistics, and information on all of the many great quarterbacks whocame out of Western Pennsylvania and much more. Raymond Berry NFL Hall of Fame Wide Receiver It’s wel Any fan of the Baltimore Colts of my era, any fan of my friend and teammate Johnny Unitas, or, for that matter, any fan of football in general should enjoy Wayne Stewart's book. It contains great stories, statistics, and information on all of the many great quarterbacks whocame out of Western Pennsylvania and much more. Raymond Berry NFL Hall of Fame Wide Receiver It’s well known that the NFL has been dominated through the years by quarterbacks sown and grown in a relatively small area surrounding the city of Pittsburgh in Western Pennsylvania. In America’s Cradle of Quarterbacks, author Wayne Stewart not only tells us who they are, he digs deep to explain the nature and nurture behind the rich harvest of signal callers (Montana, Unitas, Marino, Namath, Kelly, Blanda, etc.) who have risen from that fertile soil to claim Lombardi Trophies and dominate the gallery of busts in the Pro Football Hall of Fame. Stewart has written a fascinating book that belongs on the shelves of football historians and everyday fans alike. Jeffrey J. Miller Author of Rockin’ The Rockpile, Buffalo’sForgotten Champions, and Game Changers ...more",0,22.5,22.5,books,3,0.0,America's Cradle of Quarterbacks: Western Pennsylvania's Football Factory from Johnny Unitas to Joe Montana,c7d160c2c0de586f,https://books.toscrape.com/catalogue/americas-cradle-of-quarterbacks-western-pennsylvanias-football-factory-from-johnny-unitas-to-joe-montana_974/index.html
19,music,"How Music Works is David Byrne’s remarkable and buoyant celebration of a subject he has spent a lifetime thinking about. In it he explores how profoundly music is shaped by its time and place, and he explains how the advent of recording technology in the twentieth century forever changed our relationship to playing, performing, and listening to music.Acting as historian an How Music Works is David Byrne’s remarkable and buoyant celebration of a subject he has spent a lifetime thinking about. In it he explores how profoundly music is shaped by its time and place, and he explains how the advent of recording technology in the twentieth century forever changed our relationship to playing, performing, and listening to music.Acting as historian and anthropologist, raconteur and social scientist, he searches for patterns—and shows how those patterns have affected his own work over the years with Talking Heads and his many collaborators, from Brian Eno to Caetano Veloso. Byrne sees music as part of a larger, almost Darwinian pattern of adaptations and responses to its cultural and physical context. His range is panoptic, taking us from Wagnerian opera houses to African villages, from his earliest high school reel-to-reel recordings to his latest work in a home music studio (and all the big studios in between).Touching on the joy, the physics, and even the business of making music, How Music Works is a brainy, irresistible adventure and an impassioned argument about music’s liberating, life-affirming power. ...more",0,37.32,37.32,books,2,0.0,How Music Works,327f68a59745c102,https://books.toscrape.com/catalogue/how-music-works_979/index.html
19,thriller,"A perfect life … until she discovered it wasn’t her own.A tragic family event reveals devastating news that rips apart Bella’s comfortable existence. Embarking on a personal journey to uncover the truth, she faces a series of traumatic discoveries that take her to the ruggedly beautiful Cornish coast, where hidden truths, past betrayals and a 25-year-old mystery threaten n A perfect life … until she discovered it wasn’t her own.A tragic family event reveals devastating news that rips apart Bella’s comfortable existence. Embarking on a personal journey to uncover the truth, she faces a series of traumatic discoveries that take her to the ruggedly beautiful Cornish coast, where hidden truths, past betrayals and a 25-year-old mystery threaten not just her identity, but also her life.Chilling, complex and profoundly moving, In Her Wake is a gripping psychological thriller that questions the nature of family – and reminds us that sometimes the most shocking crimes are committed closest to home. ...more",0,12.84,12.84,books,1,0.0,In Her Wake,23356462d1320d61,https://books.toscrape.com/catalogue/in-her-wake_980/index.html
17,poetry,"A poetry that is at once harrowing, angry, and achingly beautiful Patrick Woodcock has spent the past seven years engaging with and being shaped by the people, politics, and landscapes of the Kurdish north of Iraq, Fort Good Hope in the Northwest Territories, and Azerbaijan. His powerful new collection offers a poetry that simultaneously explores hope and horror while doc A poetry that is at once harrowing, angry, and achingly beautiful Patrick Woodcock has spent the past seven years engaging with and being shaped by the people, politics, and landscapes of the Kurdish north of Iraq, Fort Good Hope in the Northwest Territories, and Azerbaijan. His powerful new collection offers a poetry that simultaneously explores hope and horror while documenting the transformative processes of coping. You can’t bury them all follows the narratives we construct to survive the tragic failures of our humanity to their very end: everything that’s buried by snow, dirt, and ash, just like everything that’s buried by politics, homophobia, sexism, racism, religion; and history is resurrected, demanding to be heard and addressed.In Woodcock’s poetry, how we deal with what resurfaces is the key. What do those who suffer really mean to those who have abandoned them to small, conscience-soothing charitable donations or the occasional tweet? How can the poet, or anyone else, sleep at night knowing homosexuals are being thrown off building tops, after one steps into a hole and finds an abandoned corpse in an Azeri cemetery, or after the elders of an Aboriginal community are left helpless against those who only want to exploit them? Still, You can’t bury them all demonstrates that the world is not just the horrific place the media often portrays. In each of the worlds he touches, Woodcock discovers a spirit and strength to celebrate. ...more",0,33.63,33.63,books,2,0.0,You can't bury them all: Poems,55f9da0c5eea2e10,https://books.toscrape.com/catalogue/you-cant-bury-them-all-poems_961/index.html
18,thriller,"The 2016 debut bloggers can't stop raving about. Perfect for fans of The Girl on the Train and The Ice Twins Everyone knows a couple like Jack and Grace.He has looks and wealth, she has charm and elegance. You might not want to like them, but you do. Though, you’d like to get to know Grace better.But it’s difficult, because you realise Jack and Grace are never apart.Some The 2016 debut bloggers can't stop raving about. Perfect for fans of The Girl on the Train and The Ice Twins Everyone knows a couple like Jack and Grace.He has looks and wealth, she has charm and elegance. You might not want to like them, but you do. Though, you’d like to get to know Grace better.But it’s difficult, because you realise Jack and Grace are never apart.Some might call this true love. Others might ask why Grace never answers the phone. Or how she can never meet for coffee, even though she doesn’t work. How she can cook such elaborate meals but remain so slim. And why there are bars on one of the bedroom windows.Sometimes, the perfect marriage is the perfect lie. ...more",0,52.22,52.22,books,4,0.0,Behind Closed Doors,be5cc846f45496fb,https://books.toscrape.com/catalogue/behind-closed-doors_962/index.html
18,default,"This new edition of Maude (1883-1993) has been updated by Mardo Williams’ daughters, adding historical details their dad wished to make, twice as many photos, and nine appendices not present in the 1996 hardcover (which won an Ohioana Library Award for its author). During her 110-year lifetime, Maude went from a 400-lb. wood-burning stove to a microwave oven, from an outdo This new edition of Maude (1883-1993) has been updated by Mardo Williams’ daughters, adding historical details their dad wished to make, twice as many photos, and nine appendices not present in the 1996 hardcover (which won an Ohioana Library Award for its author). During her 110-year lifetime, Maude went from a 400-lb. wood-burning stove to a microwave oven, from an outdoor privy to indoor plumbing. She got the vote in 1920 and voted in the next 18 Presidential elections.With poetry and human dramas (two murders and a suicide), written by a master journalist, the book shows the impact of the changing times on shy, unassuming Maude, her fun-loving husband Lee, and their four active children. They farmed 100 acres on the banks of Rush Creek in Logan County (Ohio).A favorite with book discussion groups, Maude has been adopted by several colleges for use as a supplemental American history text. ...more",0,18.02,18.02,books,2,0.0,Maude (1883-1993):She Grew Up with the country,094b269567e1c300,https://books.toscrape.com/catalogue/maude-1883-1993she-grew-up-with-the-country_964/index.html
18,mystery,"In a dark, dark wood Nora hasn't seen Clare for ten years. Not since Nora walked out of school one day and never went back. There was a dark, dark houseUntil, out of the blue, an invitation to Clare’s hen do arrives. Is this a chance for Nora to finally put her past behind her?And in the dark, dark house there was a dark, dark roomBut something goes wrong. Very wrong.And i In a dark, dark wood Nora hasn't seen Clare for ten years. Not since Nora walked out of school one day and never went back. There was a dark, dark houseUntil, out of the blue, an invitation to Clare’s hen do arrives. Is this a chance for Nora to finally put her past behind her?And in the dark, dark house there was a dark, dark roomBut something goes wrong. Very wrong.And in the dark, dark room.... Some things can’t stay secret for ever. ...more",0,19.63,19.63,books,1,0.0,"In a Dark, Dark Wood",19ed25f4641d5efd,https://books.toscrape.com/catalogue/in-a-dark-dark-wood_963/index.html
18,default,"Sent to yet another foster family, Penny decides that the way to claim a sense of self is to swim Lake Ontario. Although this seems impossible, she finds the courage to ask her physics teacher to be her coach, and wins the support of her new foster mother.",0,33.29,33.29,books,3,0.0,Penny Maybe,668fe56b17cfcd4f,https://books.toscrape.com/catalogue/penny-maybe_965/index.html
18,nonfiction,"Are you and your spouse speaking the same language? While love is a many splendored thing, it is sometimes a very confusing thing, too. And as people come in all varieties, shapes, and sizes, so do their choices of personal expressions of love. But more often than not, the giver and the receiver express love in two different ways. This can lead to misunderstanding, quarrel Are you and your spouse speaking the same language? While love is a many splendored thing, it is sometimes a very confusing thing, too. And as people come in all varieties, shapes, and sizes, so do their choices of personal expressions of love. But more often than not, the giver and the receiver express love in two different ways. This can lead to misunderstanding, quarrels, and even divorce.Quality time, words of affirmation, gifts, acts of service, and physical touch are the five basic love languages. Dr. Gary Chapman identifies these and guides couples towards a better understanding of their unique languages of love. Learn to speak and understand your mate's love language, and in no time you will be able to effectively love and truly feel loved in return. Skillful communication is within your grasp! ...more",0,31.05,31.05,books,3,0.0,The Five Love Languages: How to Express Heartfelt Commitment to Your Mate,3c039985229453bf,https://books.toscrape.com/catalogue/the-five-love-languages-how-to-express-heartfelt-commitment-to-your-mate_969/index.html
