availability,category,description,no_of_reviews,price_excl_tax,price_incl_tax,product_type,stars,tax,title,upc,url
16,food and drink,"THERE’S NO TIME LIKE DINNERTIME!Oh, don’t get me wrong. I adore breakfast. I love lunch! But dinnertime definitely tops them all. It’s the time of day when we reunite with our sweeties, our kids, our friends, our parents . . . and catch up on the events of the day over something mouthwatering and delicious. Dinnertime anchors us, nourishes us, and reassures us. It’s the gr THERE’S NO TIME LIKE DINNERTIME!Oh, don’t get me wrong. I adore breakfast. I love lunch! But dinnertime definitely tops them all. It’s the time of day when we reunite with our sweeties, our kids, our friends, our parents . . . and catch up on the events of the day over something mouthwatering and delicious. Dinnertime anchors us, nourishes us, and reassures us. It’s the greatest meal of the day! The Pioneer Woman Cooks: Dinnertime is a beloved collection of all the scrumptious supper recipes that make their way through my kitchen in regular rotation, from main dish salads to satisfying soups to hearty casseroles to comfort food classics . . . and everything in between. I lay out all the different ways I tackle dinner in my house, from super-quick 16-Minute Meals to make-ahead Freezer Food to irresistible pastas and a bundle of brand-new favorites of my crew.You’ll want to immediately dive into surefire hits like Tomato Soup with Parmesan Croutons, Buffalo Chicken Salad, Baked Ziti, and Shrimp Scampi. But just wait till you try the Cashew Chicken, French Dip Sandwiches, Chicken Marsala, and Beef Stroganoff. And don’t even get me started on the Tomato Tart, Chicken with Mustard Cream Sauce, and Pan-Fried Pork Chops. You’ll have a very tough time deciding on a favorite!To take away the guesswork, I made sure to include all the step-by-step recipe photos I love to share, and I packed as much deliciousness into each chapter as possible. My hope is that you will turn to this book regularly to solve your dinnertime dilemmas, and that you will use these recipes to feed your family time and time again. The more stains, smudges, and smears on the pages, the better!Enjoy dinnertime in your household, friends! ...more",0,56.41,56.41,books,1,0.0,"The Pioneer Woman Cooks: Dinnertime: Comfort Classics, Freezer Food, 16-Minute Meals, and Other Delicious Ways to Solve Supper!",142d767a56a9254d,https://books.toscrape.com/catalogue/the-pioneer-woman-cooks-dinnertime-comfort-classics-freezer-food-16-minute-meals-and-other-delicious-ways-to-solve-supper_943/index.html
16,childrens,"A princess and a peasant girl must embark on a dangerous quest to outwit a centuries-old warning foretelling the fall of the Monarchy in this modern fairytale. In the center of the verdant Monarchy lies Dreadwillow Carse, a black and desolate bog that the happy people of the land do their best to ignore. Little is known about it, except for one dire warning: If any monarc A princess and a peasant girl must embark on a dangerous quest to outwit a centuries-old warning foretelling the fall of the Monarchy in this modern fairytale.   In the center of the verdant Monarchy lies Dreadwillow Carse, a black and desolate bog that the happy people of the land do their best to ignore. Little is known about it, except for one dire warning: If any monarch enters Dreadwillow Carse, then the Monarchy will fall. Twelve-year-old Princess Jeniah yearns to know what the marsh could possibly conceal that might topple her family’s thousand-year reign of peace and prosperity. Meanwhile, in the nearby town of Emberfell, where everyone lives with unending joy, a girl named Aon hides a sorrow she can never reveal. She knows that something in the carse--something that sings a haunting tune only Aon can hear--holds the cure for her sadness. Yet no matter how many times she tries to enter, the terror-inducing dreadwillow trees keep her away. After a chance meeting, Princess Jeniah and Aon hatch a plan to send Aon into the heart of the carse to unlock its darkest secret. But when Aon doesn’t return, a guilt-stricken Jeniah must enter the carse to try and rescue her friend--even if it means risking the entire Monarchy. ...more",0,56.13,56.13,books,1,0.0,The Secret of Dreadwillow Carse,b5ea0b5dabed25a8,https://books.toscrape.com/catalogue/the-secret-of-dreadwillow-carse_944/index.html
16,fiction,"On a searing summer Friday, Eddie Chapman has been stuck for hours in a traffic jam. There are accidents along the highway, but ambulances and police are conspicuously absent. When he decides to abandon his car and run home, he sees that the trees along the edge of a stream have been burnt, and the water in the streambed is gone. Something is very wrong.When he arrives hom On a searing summer Friday, Eddie Chapman has been stuck for hours in a traffic jam. There are accidents along the highway, but ambulances and police are conspicuously absent. When he decides to abandon his car and run home, he sees that the trees along the edge of a stream have been burnt, and the water in the streambed is gone. Something is very wrong.When he arrives home, the power is out and there is no running water. The pipes everywhere, it seems, have gone dry. Eddie and his wife, Laura, find themselves thrust together with their neighbors while a sense of unease thickens in the stifling night air. Thirst takes place in the immediate aftermath of a mysterious disaster--the Chapmans and their neighbors suffer the effects of the heat, their thirst, and the terrifying realization that no one is coming to help. As violence rips through the community, Eddie and Laura are forced to recall secrets from their past and question their present humanity. In crisp and convincing prose, Ben Warner compels readers to do the same. What might you do to survive? ...more",0,17.27,17.27,books,5,0.0,Thirst,709822d0b5bcb7f4,https://books.toscrape.com/catalogue/thirst_946/index.html
16,add a comment,"Andrea Harding is a recent college graduate looking forward to attending Duke Law School when her world is turned upside down by the shooting of her father, Nicholas, and uncle, Michael, in a surprising and puzzling attack. They are the only family she has, aside from her paternal grandmother Dorothy, so when her uncle dies from the attack and her father lays comatose in I Andrea Harding is a recent college graduate looking forward to attending Duke Law School when her world is turned upside down by the shooting of her father, Nicholas, and uncle, Michael, in a surprising and puzzling attack. They are the only family she has, aside from her paternal grandmother Dorothy, so when her uncle dies from the attack and her father lays comatose in ICU, it falls to Andrea to not only investigate who would want to kill her father and uncle, but also to oversee Harding Industries, the family company. When her father’s longtime attorney and one of a handful of family friends, Beth Cowling, rushes to help Andrea long distance, the youngest Harding soon finds herself surrounded by a bevy of intriguing new friends and helpers. First to arrive is Beth’s own daughter, Riva, acting as Andrea’s attorney after Andrea is violently attacked in her father’s home, where she grew up, forcing her to kill both would-be assassins. When Nicholas’s on again/off again lover, state prosecutor and gubernatorial hopeful Kerry Marcus, is equally at a loss to name suspects in the Harding family attacks, Riva begins her own investigation into the short list of family friends and colleagues, including Don Marshall, former colleague of Nicholas’s at Marshall Pharmaceutical, which Don now runs, and Don’s wife Karen. Marshall has a shady past, including an incident at his company that also involved Andrea’s father. She also looks closely at Marcus Ricci, father of Andrea’s closest high school friend, Jason. After Jason’s death from leukemia, Ricci becomes like a second father to Andrea. Ricci is also widely believed to have ties to the New Jersey mob. But Beth has another contact she wants involved in the investigation, Deirdre Southington, daughter of Beth’s old friend Cordelia Southington. The Southington family has more money than God, as well as, through Deirdre, more contacts in the intriguing world of international espionage. A former NSA agent, Deirdre is mysterious and beautiful in a cold way. An eccentric who travels via private rail car, she is also extraordinarily persuasive, holding a PhD in forensic psychology that she has put to great use in both her work with the NSA and on her own, as a defender of good, rooting out evil doers and ensuring they are brought to her own brand of justice. Andrea, Riva, and Deirdre all also cast a suspicious eye on the Oakes brothers, Carlton and Jefferson, who run Oakes Industries along with their silent partner and cousin, New Jersey state senator Schuyler Colfax, who also has his eye on the governor’s seat. Oakes Industries has recently made an attempt to purchase Harding Industries, a seemingly irrational move that is rebuffed by Nicholas. What no one knows until much later is that the Oakes brothers have entered into a business deal with Russian mobster Viktor Roman, who represents the real party interested in acquiring Harding Industries, a Vor, Russian organized crime unit, with heavy international interests in the energy sector. Andrea matures quickly as she rapidly learns who she can and cannot trust during her search for the people out to kill her family. Along with her new friends and advocates, she discovers Harding Industries holds a soon to expire option to buy property that could become the source of untold billions from oil reserves, and moves in the nick of time to exercise their right to purchase. But the biggest blow for the Harding family is yet to come—the discovery that Viktor Roman has promised Kerry Marcus the governor’s seat in exchange for information about the Hardings, including Nicholas and Michael’s whereabouts on the night they are shot. Ultimately, Andrea chooses to forego law school and becomes her father’s new partner in Harding Industries, no doubt with many adventures yet to come. Masterfully told using a smattering of historical facts along with a soundtrack of classical music masterpieces, this thriller keeps readers on edge until the very end. ...more",0,19.09,19.09,books,1,0.0,The Torch Is Passed: A Harding Family Story,4eed62cf5f8d8edf,https://books.toscrape.com/catalogue/the-torch-is-passed-a-harding-family-story_945/index.html
16,nonfiction,"Capital in the Twenty-First Century meets The Second Machine Age in this stunning and optimistic tour de force on the promise and peril of the digital economy, from one of the most brilliant social critics of our time. Digital technology was supposed to usher in a new age of endless prosperity, but so far it has been used to put industrial capitalism on steroids, makin Capital in the Twenty-First Century meets The Second Machine Age in this stunning and optimistic tour de force on the promise and peril of the digital economy, from one of the most brilliant social critics of our time. Digital technology was supposed to usher in a new age of endless prosperity, but so far it has been used to put industrial capitalism on steroids, making it harder for people and businesses to keep up. Social networks surrender their original missions to more immediately profitable data mining, while brokerage houses abandon value investing for algorithms that drain markets and our 401ks alike--all tactics driven by the need to stoke growth by any means necessary. Instead of taking this opportunity to reprogram our economy for sustainability, we have doubled down on growth as its core command. We have reached the limits of this approach. We must escape the growth trap, once and for all. Media scholar and technology author Douglas Rushkoff--one of today's most original and influential thinkers--argues for a new economic program that utilizes the unique distributive power of the internet while breaking free of the winner-take-all system the growth trap leaves in its wake. Drawing on sources both contemporary and historical, Rushkoff pioneers a new understanding of the old economic paradigm, from central currency to debt to corporations and labor.Most importantly, he offers a series of practical steps for businesses, consumers, investors, and policymakers to remake the economic operating system from the inside out--and prosper along the way. Instead of boycotting Wal-Mart or overtaxing the wealthy, we simply implement strategies that foster the creation of value by stakeholders other than just ourselves. From our currency to our labor to the corporation, every aspect of the economy can be reprogrammed with minimal disruption to create a more equitably distributed prosperity for all.Inspiring and challenging, Throwing Rocks at the Google Bus provides a pragmatic, optimistic, and human-centered model for economic progress in the digital age. ...more",0,31.12,31.12,books,3,0.0,Throwing Rocks at the Google Bus: How Growth Became the Enemy of Prosperity,7858914fad68493c,https://books.toscrape.com/catalogue/throwing-rocks-at-the-google-bus-how-growth-became-the-enemy-of-prosperity_948/index.html
16,sequential art,"Every summer, Rose goes with her mom and dad to a lake house in Awago Beach. It's their getaway, their refuge. Rosie's friend Windy is always there, too, like the little sister she never had. But this summer is different. Rose's mom and dad won't stop fighting, and when Rose and Windy seek a distraction from the drama, they find themselves with a whole new set of problems. Every summer, Rose goes with her mom and dad to a lake house in Awago Beach. It's their getaway, their refuge. Rosie's friend Windy is always there, too, like the little sister she never had. But this summer is different. Rose's mom and dad won't stop fighting, and when Rose and Windy seek a distraction from the drama, they find themselves with a whole new set of problems. It's a summer of secrets and sorrow and growing up, and it's a good thing Rose and Windy have each other.In This One Summer two stellar creators redefine the teen graphic novel. Cousins Mariko and Jillian Tamaki, the team behind Skim, have collaborated on this gorgeous, heartbreaking, and ultimately hopeful story about a girl on the cusp of her teen age — a story of renewal and revelation. ...more",0,19.49,19.49,books,4,0.0,This One Summer,51653ef291ab7ddc,https://books.toscrape.com/catalogue/this-one-summer_947/index.html
16,sequential art,"DUAL WORLDS, DUAL SIGHTS In the land of Nirai Kanai, there are two realms, one that is the ""outside"" world, and another that is ""inside"" and hidden from the rest of reality. At the request of the holy Himegami, Syaoran ventures into this inside realm to investigate an anomaly, but what he sees there is very different from what Fai and Kurogane see. What does this discrepa DUAL WORLDS, DUAL SIGHTS   In the land of Nirai Kanai, there are two realms, one that is the ""outside"" world, and another that is ""inside"" and hidden from the rest of reality. At the request of the holy Himegami, Syaoran ventures into this inside realm to investigate an anomaly, but what he sees there is very different from what Fai and Kurogane see. What does this discrepancy mean, and what can they do to overcome it?! ...more",0,16.28,16.28,books,1,0.0,Tsubasa: WoRLD CHRoNiCLE 2 (Tsubasa WoRLD CHRoNiCLE #2),09555be379ad9253,https://books.toscrape.com/catalogue/tsubasa-world-chronicle-2-tsubasa-world-chronicle-2_949/index.html
16,history,"The Age of Genius explores the eventful intertwining of outward event and inner intellectual life to tell, in all its richness and depth, the story of the 17th century in Europe. It was a time of creativity unparalleled in history before or since, from science to the arts, from philosophy to politics. Acclaimed philosopher and historian A.C. Grayling points to three primar The Age of Genius explores the eventful intertwining of outward event and inner intellectual life to tell, in all its richness and depth, the story of the 17th century in Europe. It was a time of creativity unparalleled in history before or since, from science to the arts, from philosophy to politics. Acclaimed philosopher and historian A.C. Grayling points to three primary factors that led to the rise of vernacular (popular) languages in philosophy, theology, science, and literature; the rise of the individual as a general and not merely an aristocratic type; and the invention and application of instruments and measurement in the study of the natural world.Grayling vividly reconstructs this unprecedented era and breathes new life into the major figures of the seventeenth century intelligentsia who span literature, music, science, art, and philosophy--Shakespeare, Monteverdi, Galileo, Rembrandt, Locke, Newton, Descartes, Vermeer, Hobbes, Milton, and Cervantes, among many more. During this century, a fundamentally new way of perceiving the world emerged as reason rose to prominence over tradition, and the rights of the individual took center stage in philosophy and politics, a paradigmatic shift that would define Western thought for centuries to come. ...more",0,19.73,19.73,books,1,0.0,The Age of Genius: The Seventeenth Century and the Birth of the Modern Mind,a3d2a4250807f1e9,https://books.toscrape.com/catalogue/the-age-of-genius-the-seventeenth-century-and-the-birth-of-the-modern-mind_929/index.html
16,health,"In his midtwenties, Dave Asprey was a successful Silicon Valley multimillionaire. He also weighed 300 pounds, despite the fact that he was doing what doctors recommended: eating 1,800 calories a day and working out 90 minutes a day, six times a week. When his excess fat started causing brain fog and food cravings sapped his energy and willpower, Asprey turned to the same h In his midtwenties, Dave Asprey was a successful Silicon Valley multimillionaire. He also weighed 300 pounds, despite the fact that he was doing what doctors recommended: eating 1,800 calories a day and working out 90 minutes a day, six times a week. When his excess fat started causing brain fog and food cravings sapped his energy and willpower, Asprey turned to the same hacking techniques that made his fortune to ""hack"" his own biology, investing more than $300,000 and 15 years to uncover what was hindering his energy, performance, appearance, and happiness. From private brain EEG facilities to remote monasteries in Tibet, through radioactive brain scans, blood chemistry work, nervous system testing, and more, he explored traditional and alternative technologies to reach his physical and mental prime. The result? The Bulletproof Diet, an anti-inflammatory program for hunger-free, rapid weight loss and peak performance. The Bulletproof Diet will challenge—and change—the way you think about weight loss and wellness. You will skip breakfast, stop counting calories, eat high levels of healthy saturated fat, work out and sleep less, and add smart supplements.In doing so, you'll gain energy, build lean muscle, and watch the pounds melt off. By ditching traditional ""diet"" thinking, Asprey went from being overweight and sick in his twenties to maintaining a 100-pound weight loss, increasing his IQ, and feeling better than ever in his forties. The Bulletproof Diet is your blueprint to a better life. ...more",0,49.05,49.05,books,3,0.0,"The Bulletproof Diet: Lose up to a Pound a Day, Reclaim Energy and Focus, Upgrade Your Life",43c6a960757cf559,https://books.toscrape.com/catalogue/the-bulletproof-diet-lose-up-to-a-pound-a-day-reclaim-energy-and-focus-upgrade-your-life_931/index.html
16,add a comment,"On March 18, 1990, thirteen works of art today worth over $500 million were stolen from the Isabella Stewart Gardner Museum in Boston. It remains the largest unsolved art heist in history, and Claire Roth, a struggling young artist, is about to discover that there’s more to this crime than meets the eye.Making a living reproducing famous artworks for a popular online retai On March 18, 1990, thirteen works of art today worth over $500 million were stolen from the Isabella Stewart Gardner Museum in Boston. It remains the largest unsolved art heist in history, and Claire Roth, a struggling young artist, is about to discover that there’s more to this crime than meets the eye.Making a living reproducing famous artworks for a popular online retailer and desperate to improve her situation, Claire is lured into a Faustian bargain with Aiden Markel, a powerful gallery owner. She agrees to forge a painting—a Degas masterpiece stolen from the Gardner Museum—in exchange for a one-woman show in his renowned gallery. But when that very same long-missing Degas painting is delivered to Claire’s studio, she begins to suspect that it may itself be a forgery.Her desperate search for the truth leads Claire into a labyrinth of deceit where secrets hidden since the late nineteenth century may be the only evidence that can now save her life. ...more",0,40.76,40.76,books,3,0.0,The Art Forger,80cfab6bcff3a244,https://books.toscrape.com/catalogue/the-art-forger_930/index.html
16,nonfiction,"Marie Kondo’s unique KonMari Method of tidying up is nothing short of life-changing—and her first book, The Life-Changing Magic of Tidying Up, has become a worldwide sensation. In Spark Joy, Kondo presents an in-depth, illustrated manual on how to declutter and organize specific items throughout the house, from kitchen and bathroom items to work-related papers and hobby co Marie Kondo’s unique KonMari Method of tidying up is nothing short of life-changing—and her first book, The Life-Changing Magic of Tidying Up, has become a worldwide sensation. In Spark Joy, Kondo presents an in-depth, illustrated manual on how to declutter and organize specific items throughout the house, from kitchen and bathroom items to work-related papers and hobby collections. User-friendly line drawings illustrate Kondo’s patented folding method as it applies to shirts, pants, socks, and jackets, as well as images of properly organized drawers, closets, and cabinets. This book is perfect for anyone who wants a home—and life—that sparks joy. ...more",0,41.83,41.83,books,4,0.0,Spark Joy: An Illustrated Master Class on the Art of Organizing and Tidying Up,87b0615b6e1f4d7b,https://books.toscrape.com/catalogue/spark-joy-an-illustrated-master-class-on-the-art-of-organizing-and-tidying-up_927/index.html
16,spirituality,"Change and anger are in the air. Looking for answers to today’s wrenching challenges, William Martin turns to the Tao Te Ching and finds that while Taoism is known for its quiet, enigmatic wisdom, the Tao can also have the cleansing force of a rushing river.Through his interpretation of this ancient Chinese text, Martin elucidates revolutionary messages condemning power-se Change and anger are in the air. Looking for answers to today’s wrenching challenges, William Martin turns to the Tao Te Ching and finds that while Taoism is known for its quiet, enigmatic wisdom, the Tao can also have the cleansing force of a rushing river.Through his interpretation of this ancient Chinese text, Martin elucidates revolutionary messages condemning power-seeking and greed. He emphasizes that humans have a “natural virtue” that can help them heal the planet; shows how Taoism’s simplicity can be subversive and its flexibility a potent force; and reassures that “when injustice is the rule, justice always lies in wait.”Provocative and stirring, Martin’s Tao flows within and through those who ride the waves of anger and frustration and gently guides them to true freedom.“We have learned the secret of transformation: Injustice feeds our determination. Hate increases our love. Wounds bring forth our healing, and fear uncovers our courage and serenity.”— from The Activist’s Tao Te Ching ...more",0,32.24,32.24,books,5,0.0,The Activist's Tao Te Ching: Ancient Advice for a Modern Revolution,7d6d2a6c0276f81b,https://books.toscrape.com/catalogue/the-activists-tao-te-ching-ancient-advice-for-a-modern-revolution_928/index.html
16,default,"Slay Procrastination, Distraction, and Overwhelm!Who doesn’t want more time and energy for family, friends, and personal passions? Author Helene Segura coaches real people in the real world to operate more efficiently during the workday, so they can have a life outside it. Her engaging time management program caters to diverse learning styles, offering case studies that al Slay Procrastination, Distraction, and Overwhelm!Who doesn’t want more time and energy for family, friends, and personal passions? Author Helene Segura coaches real people in the real world to operate more efficiently during the workday, so they can have a life outside it. Her engaging time management program caters to diverse learning styles, offering case studies that allow readers to self-diagnose and zero in on the strategies most appropriate for them. Anyone wanting to streamline workflow and improve productivity can employ her wonderfully doable techniques — for clearing task lists, handling reminder systems, scheduling a variety of priorities, and even managing emails and phone calls. Thanks to Segura’s astute attention to personality, The Inefficiency Assassin meets readers where they are struggling and details quick and easy-to-implement strategies to, as Segura promises, “kick chaos to the curb.” ...more",0,20.59,20.59,books,5,0.0,"The Inefficiency Assassin: Time Management Tactics for Working Smarter, Not Longer",8c9e6bf2467d740d,https://books.toscrape.com/catalogue/the-inefficiency-assassin-time-management-tactics-for-working-smarter-not-longer_935/index.html
