availability,category,description,no_of_reviews,price_excl_tax,price_incl_tax,product_type,stars,tax,title,upc,url
18,childrens,"One day, a young bear stumbles upon something he has never seen before in the forest. As time passes, he teaches himself how to play the strange instrument, and eventually the beautiful sounds are heard by a father and son who are picnicking in the woods. The bear goes with them on an incredible journey to New York, where his piano playing makes him a huge star. He has fam One day, a young bear stumbles upon something he has never seen before in the forest. As time passes, he teaches himself how to play the strange instrument, and eventually the beautiful sounds are heard by a father and son who are picnicking in the woods. The bear goes with them on an incredible journey to New York, where his piano playing makes him a huge star. He has fame, fortune and all the music in the world, but he misses the friends and family he has left behind. A moving tale of exploration and belonging from an exciting debut author-illustrator. ...more",0,36.89,36.89,books,1,0.0,The Bear and the Piano,9f6568e9c95f60b0,https://books.toscrape.com/catalogue/the-bear-and-the-piano_967/index.html
18,thriller,"Mark Fallon is an overworked detective investigating a spate of attacks at a string of high profile city centre nightclubs. Scott is a dejected 24 year old struggling to make ends meet working for his brother and supplementing his income with a small-scale drug dealing operation. Angela is an attractive 23 year old, raised by her father, a career criminal and small time dr Mark Fallon is an overworked detective investigating a spate of attacks at a string of high profile city centre nightclubs. Scott is a dejected 24 year old struggling to make ends meet working for his brother and supplementing his income with a small-scale drug dealing operation. Angela is an attractive 23 year old, raised by her father, a career criminal and small time drug dealer who supplies Scott with cannabis. This is a chilling tale spanning a few months in the lives of Scott and Angela, where realizations about the present combine with shocking revelations from the past leading to an apocalyptic climax where they no longer know whom they can trust. ...more",0,23.82,23.82,books,5,0.0,The Elephant Tree,5dada2b7be26bd03,https://books.toscrape.com/catalogue/the-elephant-tree_968/index.html
16,fiction,"The Freeman family--Charles, Laurel, and their daughters, teenage Charlotte and nine-year-old Callie--have been invited to the Toneybee Institute in rural Massachusetts to participate in a research experiment. They will live in an apartment on campus with Charlie, a young chimp abandoned by his mother. The Freemans were selected for the experiment because they know sign la The Freeman family--Charles, Laurel, and their daughters, teenage Charlotte and nine-year-old Callie--have been invited to the Toneybee Institute in rural Massachusetts to participate in a research experiment. They will live in an apartment on campus with Charlie, a young chimp abandoned by his mother. The Freemans were selected for the experiment because they know sign language; they are supposed to teach it to Charlie and welcome him as a member of their family. Isolated in their new, nearly all-white community not just by their race but by their strange living situation, the Freemans come undone. And when Charlotte discovers the truth about the Institute’s history of questionable studies, the secrets of the past begin to invade the present. The power of this novel resides in Kaitlyn Greenidge’s undeniable storytelling talents. What appears to be a story of mothers and daughters, of sisterhood put to the test, of adolescent love and grown-up misconduct, and of history’s long reach, becomes a provocative and compelling exploration of America’s failure to find a language to talk about race. ...more",0,50.27,50.27,books,5,0.0,"We Love You, Charlie Freeman",8d455c7539795d2a,https://books.toscrape.com/catalogue/we-love-you-charlie-freeman_954/index.html
18,philosophy,"A page-turning novel that is also an exploration of the great philosophical concepts of Western thought, Sophie’s World has fired the imagination of readers all over the world, with more than twenty million copies in print.One day fourteen-year-old Sophie Amundsen comes home from school to find in her mailbox two notes, with one question on each: “Who are you?” and “Where A page-turning novel that is also an exploration of the great philosophical concepts of Western thought, Sophie’s World has fired the imagination of readers all over the world, with more than twenty million copies in print.One day fourteen-year-old Sophie Amundsen comes home from school to find in her mailbox two notes, with one question on each: “Who are you?” and “Where does the world come from?” From that irresistible beginning, Sophie becomes obsessed with questions that take her far beyond what she knows of her Norwegian village. Through those letters, she enrolls in a kind of correspondence course, covering Socrates to Sartre, with a mysterious philosopher, while receiving letters addressed to another girl. Who is Hilde? And why does her mail keep turning up? To unravel this riddle, Sophie must use the philosophy she is learning—but the truth turns out to be far more complicated than she could have imagined. ...more",0,15.94,15.94,books,5,0.0,Sophie's World,6be3beb0793a53e7,https://books.toscrape.com/catalogue/sophies-world_966/index.html
16,poetry,"More than thirty-five years ago, when the weather allowed, Wendell Berry began spending his sabbaths outdoors, walking and wandering around familiar territory, seeking a deep intimacy only time could provide. These walks arranged themselves into poems and each year since he has completed a sequence dated by the year of its composition. Last year we collected the lot into a More than thirty-five years ago, when the weather allowed, Wendell Berry began spending his sabbaths outdoors, walking and wandering around familiar territory, seeking a deep intimacy only time could provide. These walks arranged themselves into poems and each year since he has completed a sequence dated by the year of its composition. Last year we collected the lot into a collection, This Day, the Sabbath Poems 1979-2013. This new sequence for the following year is one of the richest yet. This group provides a virtual syllabus for all of Mr. Berry’s cultural and agricultural work in concentrated form. Many of these poems are drawn from the view from a small porch in the woods, a place of stillness and reflection, a vantage point “of the one/life of the forest composed/of uncountable lives in countless/years each life coherent itself within/ the coherence, the great composure,/of all.” A new collection of Wendell Berry poems is always an occasion of joyful celebration and this one is especially so. ...more",0,14.27,14.27,books,4,0.0,Untitled Collection: Sabbath Poems 2014,657fe5ead67a7767,https://books.toscrape.com/catalogue/untitled-collection-sabbath-poems-2014_953/index.html
16,fantasy,"After a savage attack drives her from her home, sixteen-year-old Mnemba finds a place in her cousin Tumelo’s successful safari business, where she quickly excels as a guide. Surrounding herself with nature and the mystical animals inhabiting the savannah not only allows Mnemba’s tracking skills to shine, it helps her to hide from the terrible memories that haunt her.Mnemba After a savage attack drives her from her home, sixteen-year-old Mnemba finds a place in her cousin Tumelo’s successful safari business, where she quickly excels as a guide. Surrounding herself with nature and the mystical animals inhabiting the savannah not only allows Mnemba’s tracking skills to shine, it helps her to hide from the terrible memories that haunt her.Mnemba is employed to guide Mr. Harving and his daughter, Kara, through the wilderness as they study unicorns. The young women are drawn to each other, despite that fact that Kara is betrothed. During their research, they discover a conspiracy by a group of poachers to capture the Unicorns and exploit their supernatural strength to build a railway. Together, they must find a way to protect the creatures Kara adores while resisting the love they know they can never indulge. ...more",0,18.78,18.78,books,3,0.0,Unicorn Tracks,7ae099f3898e0209,https://books.toscrape.com/catalogue/unicorn-tracks_951/index.html
16,history,"Although we usually think of technology as something unique to modern times, our ancestors began to create the first technologies millions of years ago in the form of prehistoric tools and weapons. Over time, eight key technologies gradually freed us from the limitations of our animal origins.The fabrication of weapons, the mastery of fire, and the technologies of clothing Although we usually think of technology as something unique to modern times, our ancestors began to create the first technologies millions of years ago in the form of prehistoric tools and weapons. Over time, eight key technologies gradually freed us from the limitations of our animal origins.The fabrication of weapons, the mastery of fire, and the technologies of clothing and shelter radically restructured the human body, enabling us to walk upright, shed our body hair, and migrate out of tropical Africa. Symbolic communication transformed human evolution from a slow biological process into a fast cultural process. The invention of agriculture revolutionized the relationship between humanity and the environment, and the technologies of interaction led to the birth of civilization. Precision machinery spawned the industrial revolution and the rise of nation-states; and in the next metamorphosis, digital technologies may well unite all of humanity for the benefit of future generations.Synthesizing the findings of primatology, paleontology, archeology, history, and anthropology, Richard Currier reinterprets and retells the modern narrative of human evolution that began with the discovery of Lucy and other Australopithecus fossils. But the same forces that allowed us to integrate technology into every aspect of our daily lives have also brought us to the brink of planetary catastrophe. Unbound explains both how we got here and how human society must be transformed again to achieve a sustainable future.Technology: “The deliberate modification of any natural object or substance with forethought to achieve a specific end or to serve a specific purpose.” ...more",0,25.52,25.52,books,1,0.0,"Unbound: How Eight Technologies Made Us Human, Transformed Society, and Brought Our World to the Brink",9a9d6e9bc555731e,https://books.toscrape.com/catalogue/unbound-how-eight-technologies-made-us-human-transformed-society-and-brought-our-world-to-the-brink_950/index.html
17,nonfiction,"There is a cosmic alarm clock going off around the world! #HigherSelfie's aim is to unite all those waking up spiritually in this digital age. This book is a guide to love, connection, and kickass surrendered action for young people who have at least a toe in the door of spirituality. With a no-nonsense approach and full of wit and humor, this book shares age-old concepts There is a cosmic alarm clock going off around the world! #HigherSelfie's aim is to unite all those waking up spiritually in this digital age. This book is a guide to love, connection, and kickass surrendered action for young people who have at least a toe in the door of spirituality. With a no-nonsense approach and full of wit and humor, this book shares age-old concepts in a language that is accessible to the modern spiritual audience. Whether you have just bought a yoga mat or have been meditating for years, this book will offer you guidance and support, whatever stage of the journey you're at. Life coaches Jo Westwood and Lucy Sheridan touch upon timeless topics such as forgiveness, surrender and the ego, as well as subjects specific to the current age, such as using social media in a healthy way, finding a like-minded tribe, and following your own spiritual and life paths without comparing yourself to others. Whether you're a Reiki master, climbing the corporate ladder or working in a suburban garden center #HigherSelfie will be the perfect ‘gateway drug’ for those looking for something deeper and more meaningful. ...more",0,23.11,23.11,books,5,0.0,#HigherSelfie: Wake Up Your Life. Free Your Soul. Find Your Tribe.,c27f6e1f185b0383,https://books.toscrape.com/catalogue/higherselfie-wake-up-your-life-free-your-soul-find-your-tribe_957/index.html
16,nonfiction,"It all started with Nathanael Johnson’s decision to teach his daughter the name of every tree they passed on their walk to day care in San Francisco. This project turned into a quest to discover the secrets of the neighborhood’s flora and fauna, and yielded more than names and trivia: Johnson developed a relationship with his nonhuman neighbors.Johnson argues that learning It all started with Nathanael Johnson’s decision to teach his daughter the name of every tree they passed on their walk to day care in San Francisco. This project turned into a quest to discover the secrets of the neighborhood’s flora and fauna, and yielded more than names and trivia: Johnson developed a relationship with his nonhuman neighbors.Johnson argues that learning to see the world afresh, like a child, shifts the way we think about nature: Instead of something distant and abstract, nature becomes real—all at once comical, annoying, and beautiful. This shift can add tremendous value to our lives, and it might just be the first step in saving the world.No matter where we live—city, country, oceanside, ormountains—there are wonders that we walk past every day. Unseen City widens the pinhole of our perspective by allowing us to view the world from the high-altitude eyes of a turkey vulture and the distinctly low-altitude eyes of a snail. The narrative allows us to eavesdrop on the comically frenetic life of a squirrel and peer deep into the past with a ginkgo biloba tree. Each of these organisms has something unique to tell us about our neighborhoods and, chapter by chapter, Unseen City takes us on a journey that is part nature lesson and part love letter to the world’s urban jungles. With the right perspective, a walk to the subway can be every bit as entrancing as a walk through a national park. ...more",0,44.18,44.18,books,4,0.0,"Unseen City: The Majesty of Pigeons, the Discreet Charm of Snails & Other Wonders of the Urban Wilderness",d170b5a0da46380e,https://books.toscrape.com/catalogue/unseen-city-the-majesty-of-pigeons-the-discreet-charm-of-snails-other-wonders-of-the-urban-wilderness_952/index.html
16,contemporary,"We are seventeen and shattered and still dancing. We have messy, throbbing hearts, and we are stronger than anyone could ever know…Jonah never thought a girl like Vivi would come along.Vivi didn’t know Jonah would light up her world.Neither of them expected a summer like this…a summer that would rewrite their futures.In an unflinching story about new love, old wounds, and We are seventeen and shattered and still dancing. We have messy, throbbing hearts, and we are stronger than anyone could ever know…Jonah never thought a girl like Vivi would come along.Vivi didn’t know Jonah would light up her world.Neither of them expected a summer like this…a summer that would rewrite their futures.In an unflinching story about new love, old wounds, and forces beyond our control, two teens find that when you collide with the right person at just the right time, it will change you forever. ...more",0,31.77,31.77,books,1,0.0,When We Collided,3ecb690d1542c568,https://books.toscrape.com/catalogue/when-we-collided_955/index.html
16,new adult,"For Annie London, a month in a Central American rainforest means handing out mosquito nets, giving medical aid, and teaching children about the birds and the bees. With any luck, it will also land her application in the “accepted” pile at a top tier medical school. But as soon as she steps off the plane, Annie realizes her bug spray, feeble Spanish, and medical supplies wo For Annie London, a month in a Central American rainforest means handing out mosquito nets, giving medical aid, and teaching children about the birds and the bees. With any luck, it will also land her application in the “accepted” pile at a top tier medical school. But as soon as she steps off the plane, Annie realizes her bug spray, feeble Spanish, and medical supplies won’t help her deal with her new feelings for Felipe—her best friend's older brother, who's much hotter than she remembers, and who also happens to be the doctor in charge of the trip.Gawking “volun-tourists” may keep his family’s medical clinic afloat, but Dr. Felipe Gutierrez doesn’t have to like them. Or the way they make snap judgments about his practice and the people he cares for. But when his old crush, Annie, shows up to volunteer, her killer curves and kind smile fan the embers of a flame Felipe didn’t realize he’d been carrying. A flame that makes him question all his preconceived notions.As ideas and cultures clash, Annie and Felipe must decide how far outside their comfort zones they are willing to go—both for their work and for one another. ...more",0,45.07,45.07,books,2,0.0,Without Borders (Wanderlove #1),acddfeab2a407640,https://books.toscrape.com/catalogue/without-borders-wanderlove-1_956/index.html
16,young adult,"One class assignment. One second chance at love. The school player is all in. Now he needs to win back the sweet commitment girl who's forever owned his heart. Justin Carter has a secret. He's not the total player Fairfield Academy believes him to be. Not really. In fact, he used to be a one-woman guy...and his feelings for her never went away. Too bad he broke her heart t One class assignment. One second chance at love. The school player is all in. Now he needs to win back the sweet commitment girl who's forever owned his heart. Justin Carter has a secret. He's not the total player Fairfield Academy believes him to be. Not really. In fact, he used to be a one-woman guy...and his feelings for her never went away. Too bad he broke her heart three years ago and made sure to ruin any chance she'd ever forgive him. Peyton Williams is a liar. She pretends to be whole, counting down the days until graduation and helping her parents at the family ranch. But the truth is, she's done everything she can to get over Justin, and salvation is just around the corner. With graduation one short month away, she'll soon break free from the painful memories and start her life fresh. Of course, she has to get through working with him on one last assignment first. For Justin, nothing ever felt as right as being with Peyton, and now that fate's given him a shot at redemption, he's determined to make the most of it. And for Peyton...well, Justin Carter has always been her kryptonite. ...more",0,45.22,45.22,books,3,0.0,The Natural History of Us (The Fine Art of Pretending #2),cedf82b5086e4691,https://books.toscrape.com/catalogue/the-natural-history-of-us-the-fine-art-of-pretending-2_941/index.html
17,nonfiction,"I want life. I want to read it and write it and feel it and live it. I want, for as much of the time as possible in this blink-of-an-eye existence we have, to feel all that can be felt. I hate depression. I am scared of it. Terrified, in fact. But at the same time, it has made me who I am. And if - for me - it is the price of feeling life, it's a price always worth paying. I want life. I want to read it and write it and feel it and live it. I want, for as much of the time as possible in this blink-of-an-eye existence we have, to feel all that can be felt. I hate depression. I am scared of it. Terrified, in fact. But at the same time, it has made me who I am. And if - for me - it is the price of feeling life, it's a price always worth paying.Reasons to Stay Alive is about making the most of your time on earth. In the western world the suicide rate is highest amongst men under the age of 35. Matt Haig could have added to that statistic when, aged 24, he found himself staring at a cliff-edge about to jump off. This is the story of why he didn't, how he recovered and learned to live with anxiety and depression. It's also an upbeat, joyous and very funny exploration of how live better, love better, read better and feel more. ...more",0,26.41,26.41,books,2,0.0,Reasons to Stay Alive,c8f7f0cb1abb9cac,https://books.toscrape.com/catalogue/reasons-to-stay-alive_959/index.html
17,poetry,"The eagerly anticipated debut from one of Canada’s most exciting new poets In her debut collection, Ashley-Elizabeth Best explores the cultivation of resilience during uncertain and often trying times. It’s a book built around day-to-day conflicts — poems about love, family, grief, power, and longing. Navigating the fault lines of popular culture and traditional poetry to The eagerly anticipated debut from one of Canada’s most exciting new poets In her debut collection, Ashley-Elizabeth Best explores the cultivation of resilience during uncertain and often trying times. It’s a book built around day-to-day conflicts — poems about love, family, grief, power, and longing. Navigating the fault lines of popular culture and traditional poetry to assert that we are all history makers, Slow States of Collapse enters the landscape of personal narrative in an attempt to reconcile life’s little universal griefs.Slow States of Collapse presents a world that is at once menacing and full of wonder and grace. It’s a poetry of “casual cruelty” and “kisses like / puncture wounds,” of “something too tender to touch” and “the threat of an intense beauty.” In this collection, illness confronts bedside manners while a migrant restlessness also paints remarkable portraits of shifting self-image, and in the process the nature of personal and political power is reimagined. ...more",0,57.31,57.31,books,3,0.0,Slow States of Collapse: Poems,b4fd5943413e089a,https://books.toscrape.com/catalogue/slow-states-of-collapse-poems_960/index.html
17,fiction,"Paris is burning--and only Private's Jack Morgan can put out the fire.When Jack Morgan stops by Private's Paris office, he envisions a quick hello during an otherwise relaxing trip filled with fine food and sightseeing. But Jack is quickly pressed into duty after a call from his client Sherman Wilkerson, asking Jack to track down his young granddaughter who is on the run f Paris is burning--and only Private's Jack Morgan can put out the fire.When Jack Morgan stops by Private's Paris office, he envisions a quick hello during an otherwise relaxing trip filled with fine food and sightseeing. But Jack is quickly pressed into duty after a call from his client Sherman Wilkerson, asking Jack to track down his young granddaughter who is on the run from a brutal drug dealer.Before Jack can locate her, several members of France's cultural elite are found dead--murdered in stunning, symbolic fashion. The only link between the crimes is a mysterious graffiti tag. As religious and ethnic tensions simmer in the City of Lights, only Jack and his Private team can connect the dots before the smoldering powder keg explodes. ...more",0,47.61,47.61,books,5,0.0,Private Paris (Private #10),b12b89017878a60d,https://books.toscrape.com/catalogue/private-paris-private-10_958/index.html
16,mystery,"A simple task, Attorney Chester Morgan thinks. Get a copy of a public record for a young man whose only friend has died in an unexplained accidental death. Except... The police file regarding the demise of sex worker Tanya Everly has been sealed by the order of the chief of police, and no one will talk. Warned to drop the matter, Attorney Morgan knows that if he doesn't sp A simple task, Attorney Chester Morgan thinks. Get a copy of a public record for a young man whose only friend has died in an unexplained accidental death. Except... The police file regarding the demise of sex worker Tanya Everly has been sealed by the order of the chief of police, and no one will talk. Warned to drop the matter, Attorney Morgan knows that if he doesn't speak for the dead young woman, no one will. Haunted by his discovery of the body of a prominent local oilman, Morgan pursues a quest for justice that puts his reputation, career, and life at risk. A journey that takes him into the dark shadows of the sex-for-sale business, into the marble courtrooms of Oklahoma, and into the aching loneliness of his own soul. Set in the American Southwest in the days before 9/11, The Past Never Ends is both a complex murder mystery and a meditation on the self-perpetuating nature of injustice and the ethereal nature of justice itself. ...more",0,56.5,56.5,books,4,0.0,The Past Never Ends,5ee94540d0749ea0,https://books.toscrape.com/catalogue/the-past-never-ends_942/index.html
